{
  "schema": "re-probe/1",
  "probe_id": "p-fbd051e665f2",
  "kind": "cli",
  "cmd": [
    "{{KUNA}}",
    "decompile-all",
    "{{BIN}}",
    "--option",
    "callrettype",
    "off"
  ],
  "cwd": "{{WORK}}",
  "env": {
    "SLEIGHHOME": "{{SPECS}}"
  },
  "stdin": null,
  "timeout_s": 120,
  "repeat": 1,
  "target": {
    "binary_rel": "decompiler/crates/kuna-analysis/tests/fixtures/callrettype_gcc_O0_x86_64",
    "binary_sha256": "9a2c3a6082b1745368ef778c20969f560ea6f956cb9b2d3798729e306f16bb89",
    "binary_size": 17432,
    "binary_source": "in-repo",
    "in_repo_path": "decompiler/crates/kuna-analysis/tests/fixtures/callrettype_gcc_O0_x86_64",
    "selector": "upper_of_rest",
    "selector_kind": "name"
  },
  "expect": {
    "exit_code": {
      "eq": 0
    },
    "stdout_matches": [
      "char \\* skip_blanks\\(char \\*a0\\)",
      "v1 = \\(char \\*\\)skip_blanks\\(a0\\);",
      "FILE \\* pick_stream\\(int a0\\)",
      "stream = \\(FILE \\*\\)pick_stream\\(a0\\);",
      "s = \\(a0\\) \\? \\(char \\*\\)after_colon\\(a0\\) : \\(char \\*\\)fallback_name\\(\\);"
    ]
  },
  "notes": "OFF: the callee's own listing declares char * skip_blanks and FILE * pick_stream, but a call's result has no type of its own, so every caller that keeps it prints (char *)skip_blanks(a0) and (FILE *)pick_stream(a0)."
}
