{
  "schema": "re-probe/1",
  "probe_id": "a-5f6158eb1e9d",
  "kind": "cli",
  "cmd": [
    "{{KUNA}}",
    "decompile-all",
    "{{BIN}}"
  ],
  "cwd": "{{WORK}}",
  "env": {
    "SLEIGHHOME": "{{SPECS}}"
  },
  "stdin": null,
  "timeout_s": 120,
  "repeat": 1,
  "target": {
    "binary_rel": "decompiler/crates/kuna-analysis/tests/fixtures/protoorder_x86_64",
    "binary_sha256": "69e7f12f215e9ba62ef5412171670b0cebcdc7b9c3d7d13d43021fb9e9aac2a9",
    "binary_size": 9288,
    "binary_source": "in-repo",
    "in_repo_path": "decompiler/crates/kuna-analysis/tests/fixtures/protoorder_x86_64",
    "selector": "caller",
    "selector_kind": "name"
  },
  "expect": {
    "exit_code": {
      "eq": 0
    },
    "stdout_matches": [
      "int callee\\(unsigned char \\*a0,int a1\\)",
      "unsigned long caller\\(unsigned char \\*a0,int a1\\)",
      "caller\\(\\(unsigned char \\*\\)0x402000,3\\);",
      "vfmt\\(\\(unsigned char \\*\\)0x402004\\);",
      "thunk\\(a0,1,2,3,4\\);"
    ],
    "stdout_absent": [
      "unsigned long caller\\(unsigned long a0,int a1\\)",
      "caller\\(0x402000,3\\);",
      "vfmt\\(\\(unsigned char \\*\\)0x402004,a1"
    ]
  },
  "notes": "The DEFAULT (`protoorder types`): `callee` is decompiled first and states the types it recovered, so the argument `caller` forwards to it is typed and `caller`'s own parameter becomes `unsigned char *a0`. Every call keeps exactly the arguments the OFF arm renders -- `thunk` recovers one parameter and its call still passes five."
}
