{
  "schema": "re-probe/1",
  "probe_id": "a-ddc5496835ba",
  "kind": "cli",
  "cmd": [
    "{{KUNA}}",
    "functions",
    "{{BIN}}",
    "--json"
  ],
  "cwd": "{{WORK}}",
  "env": {
    "SLEIGHHOME": "{{SPECS}}"
  },
  "stdin": null,
  "timeout_s": 120,
  "repeat": 1,
  "target": {
    "binary_rel": "decompiler/crates/kuna-analysis/tests/fixtures/aif_gap_x86_64",
    "binary_sha256": "1a592a85f424cc2db8953d5a38c86676bcee5e37b242b6fb6244a2c9fccfeeef",
    "binary_size": 14408,
    "binary_source": "in-repo",
    "in_repo_path": "decompiler/crates/kuna-analysis/tests/fixtures/aif_gap_x86_64",
    "selector": null,
    "selector_kind": "none"
  },
  "expect": {
    "json": [
      {
        "path": "functions[0].size",
        "op": "exists"
      }
    ]
  },
  "notes": "Desired: every functions --json record carries size, the field decompile-all --json already emits. Vendorable (in-repo fixture) so this promotes into tests/cli/ verbatim."
}
