{
  "schema": "re-probe/1",
  "probe_id": "a-a6bf7ded3fad",
  "kind": "cli",
  "cmd": [
    "{{KUNA}}",
    "xrefs",
    "{{BIN}}",
    "--to",
    "0x1400079b0",
    "--json"
  ],
  "cwd": "{{WORK}}",
  "env": {
    "SLEIGHHOME": "{{SPECS}}"
  },
  "stdin": null,
  "timeout_s": 300,
  "repeat": 1,
  "target": {
    "binary_rel": "decompiler/crates/kuna-analysis/tests/fixtures/pe_imports.exe",
    "binary_sha256": "963e04af7e654da9344fbcfb89e37a49838d38624949895352ca1a77149f74c5",
    "binary_size": 498895,
    "binary_source": "in-repo",
    "in_repo_path": "decompiler/crates/kuna-analysis/tests/fixtures/pe_imports.exe",
    "selector": "0x1400079b0",
    "selector_kind": "addr"
  },
  "expect": {
    "exit_code": {
      "eq": 0
    },
    "stdout_is_json": true,
    "json": [
      {
        "path": "target.name",
        "op": "eq",
        "value": "VirtualProtect"
      },
      {
        "path": "count",
        "op": "eq",
        "value": 2
      },
      {
        "path": "target.aliases[0].address_hex",
        "op": "eq",
        "value": "0x14000d234"
      },
      {
        "path": "xrefs[0].from_address_hex",
        "op": "eq",
        "value": "0x140001a9e"
      },
      {
        "path": "xrefs[1].from_address_hex",
        "op": "eq",
        "value": "0x140001cce"
      },
      {
        "path": "xrefs[*].from_address_hex",
        "op": "ne",
        "value": "0x1400079b0"
      }
    ]
  },
  "notes": "Promoted acceptance of docs/re-needs/xrefs-unify-pe-import.md, re-pointed from the dataset PE to its vendored MinGW twin (CI has no dataset): same defect, same import, veneer 0x1400079b0 / IAT slot 0x14000d234, count 0 before the fix. Stronger than the recorded count>0 -- the rows must be the REAL uses, and the last clause forbids the veneer's own jmp [slot] from padding the count."
}
