{
  "schema": "re-probe/1",
  "kind": "cli",
  "cmd": [
    "{{KUNA}}",
    "decompile",
    "{{BIN}}",
    "csjmp"
  ],
  "cwd": "{{WORK}}",
  "env": {
    "SLEIGHHOME": "{{SPECS}}"
  },
  "stdin": null,
  "timeout_s": 60,
  "repeat": 1,
  "target": {
    "binary_rel": "decompiler/crates/kuna-analysis/tests/fixtures/constselectjump_x86_64",
    "binary_sha256": "57a9bd249514160cb7c8426f88a0b0dec4914421b9ae8ff28c086c5b65734e0e",
    "binary_size": 5104,
    "binary_source": "in-repo",
    "in_repo_path": "decompiler/crates/kuna-analysis/tests/fixtures/constselectjump_x86_64",
    "selector": "csjmp",
    "selector_kind": "name"
  },
  "expect": {
    "exit_code": {
      "eq": 0
    },
    "stdout_matches": [
      "switch\\(\\(unsigned long\\)v[0-9]+\\)",
      "case 0x100020:",
      "case 0x100030:",
      "return a1 \\+ 1;",
      "return a1 \\+ -1;"
    ],
    "stdout_absent": [
      "jump-as-call",
      "structured blocks unavailable"
    ]
  },
  "notes": "Desired: an indirect branch whose destinations are constants selected by a conditional move is recovered as a jump table, so both arms are decoded. Reduction of crackmes.one 5b52f6eb33c5d41c0b8ae55f (Mach-O LOL @0x10003c9e0), whose whole body was `(*v1)(); // jump-as-call`. Source: constselectjump_x86_64.s. `--option constselectjump off` restores the defect; `--mode aggressive` carries it on."
}
