{
  "schema": "re-probe/1",
  "kind": "cli",
  "target": {
      "binary_rel": "decompiler/crates/kuna-analysis/tests/fixtures/pe_iatincode_i386.exe",
      "binary_sha256": "fc9a367d8615741a122c5b0dbd3d3042f408cbce93451a796bcc45f7710c719b",
      "binary_size": 4608,
      "binary_source": "in-repo",
      "in_repo_path": "decompiler/crates/kuna-analysis/tests/fixtures/pe_iatincode_i386.exe"
  },
  "timeout_s": 60,
  "cmd": [
    "{{KUNA}}",
    "decompile-all",
    "{{BIN}}",
    "--json",
    "--filter",
    "^VirtualAlloc$",
    "--no-vars"
  ],
  "expect": {
    "exit_code": {
      "eq": 0
    },
    "json": [
      {
        "path": "count",
        "op": "eq",
        "value": 0
      }
    ]
  },
  "notes": "Vendored twin of the reported crypter: a PE32 whose one section is CODE|EXECUTE|READ|WRITE (0xe0000060) and holds the whole import directory, so its VirtualAlloc/GetModuleHandleA/ExitProcess IAT slots sit in code exactly as the original's 50 do. Built by the sibling pe_iatincode_i386.py. The dataset image stays the witness in Reproduction."
}
