{
  "schema": "re-probe/1",
  "kind": "cli",
  "cmd": [
    "{{KUNA}}",
    "functions",
    "{{BIN}}",
    "--summary",
    "--json"
  ],
  "cwd": "{{WORK}}",
  "env": {
    "SLEIGHHOME": "{{SPECS}}"
  },
  "stdin": null,
  "timeout_s": 60,
  "repeat": 1,
  "target": {
    "binary_rel": "decompiler/crates/kuna-analysis/tests/fixtures/pe_dosmagic_i386.exe",
    "binary_sha256": "e53a812817447fa428948cfd4a6f296747cfa42e2acba4e03f78e474941ac912",
    "binary_size": 1024,
    "binary_source": "in-repo",
    "in_repo_path": "decompiler/crates/kuna-analysis/tests/fixtures/pe_dosmagic_i386.exe",
    "selector": null,
    "selector_kind": "none"
  },
  "expect": {
    "exit_code": {
      "eq": 0
    },
    "stdout_is_json": true,
    "json": [
      {
        "path": "count",
        "op": "gt",
        "value": 0
      },
      {
        "path": "summary.entry.address_hex",
        "op": "eq",
        "value": "0x401000"
      },
      {
        "path": "warnings[0]",
        "op": "matches",
        "value": "e_magic is 0x5a15, not MZ.*e_lfanew 0x40 -> PE signature"
      }
    ],
    "stderr_matches": [
      "\\[kuna\\] PE DOS header e_magic is 0x5a15, not MZ"
    ],
    "stderr_absent": [
      "Unknown file magic"
    ]
  },
  "notes": "A 1024-byte PE32 (two functions, the pe_datadircount_i386 layout with a well-formed data-directory count) whose first byte is 0x15 instead of 'M', as in the reported image, while e_lfanew still points at an intact PE signature. In-repo so the probe promotes into tests/cli/."
}
